{
  "nom": "Wolfram 30 - chaos lumineux",
  "alphabet_entree": [
    0,
    1
  ],
  "alphabet_sortie": [
    0,
    1
  ],
  "taille_voisinage": 3,
  "nombre_canaux_sortie": 1,
  "mode_regle": "table",
  "table_transition": {
    "[1,1,1]": [
      0
    ],
    "[1,1,0]": [
      0
    ],
    "[1,0,1]": [
      0
    ],
    "[1,0,0]": [
      1
    ],
    "[0,1,1]": [
      1
    ],
    "[0,1,0]": [
      1
    ],
    "[0,0,1]": [
      1
    ],
    "[0,0,0]": [
      0
    ]
  },
  "largeur": 161,
  "hauteur": 110,
  "etat_initial": {
    "mode": "centre"
  },
  "rendu": {
    "taille_cellule": 5,
    "fond": "#06050a",
    "palette": [
      "#06050a",
      "#ff9d4d",
      "#ffd166",
      "#53b0ff"
    ]
  }
}