{
  "nom": "Aurore multi-canal",
  "alphabet_entree": [
    0,
    1
  ],
  "alphabet_sortie": [
    0,
    1,
    2,
    3
  ],
  "taille_voisinage": 3,
  "nombre_canaux_sortie": 2,
  "mode_regle": "table",
  "table_transition": {
    "[1,1,1]": [
      0,
      3
    ],
    "[1,1,0]": [
      2,
      1
    ],
    "[1,0,1]": [
      3,
      2
    ],
    "[1,0,0]": [
      1,
      0
    ],
    "[0,1,1]": [
      2,
      3
    ],
    "[0,1,0]": [
      1,
      1
    ],
    "[0,0,1]": [
      3,
      0
    ],
    "[0,0,0]": [
      0,
      0
    ]
  },
  "largeur": 161,
  "hauteur": 105,
  "etat_initial": {
    "mode": "centre"
  },
  "rendu": {
    "taille_cellule": 5,
    "fond": "#05070d",
    "afficher_zero": false,
    "palette": [
      "#05070d",
      "#00f0a0",
      "#b43cff",
      "#3cc8ff"
    ]
  }
}